{"clause_ids":[],"definition_id":"shoulder.reach","definition_version":1,"explicit_parameters":[],"instance_id":"arm.1","parameters":[{"name":"angle","schema_version":1,"value":4},{"name":"duration_s","schema_version":1,"value":1.5},{"name":"frame","schema_version":1,"value":"joint_parent"},{"name":"hold_s","schema_version":1,"value":0.1},{"name":"left_angle","schema_version":1,"value":null},{"name":"return_policy","schema_version":1,"value":"return_to_entry"},{"name":"right_angle","schema_version":1,"value":null},{"name":"side","schema_version":1,"value":"left"}],"schema_version":1}