{"clause_ids":[],"definition_id":"neck.lead","definition_version":1,"explicit_parameters":["neck_policy"],"instance_id":"move.1","parameters":[{"name":"duration_s","schema_version":1,"value":1},{"name":"hold_s","schema_version":1,"value":0.2},{"name":"neck_policy","schema_version":1,"value":"head_only"},{"name":"neck_share","schema_version":1,"value":0.4},{"name":"pitch","schema_version":1,"value":0},{"name":"return_policy","schema_version":1,"value":"return_to_entry"},{"name":"yaw","schema_version":1,"value":30}],"schema_version":1}
