{"clause_ids":[],"definition_id":"hand.trace","definition_version":1,"explicit_parameters":[],"instance_id":"hand.1","parameters":[{"name":"distance_m","schema_version":1,"value":0.02},{"name":"duration_s","schema_version":1,"value":1.5},{"name":"elbow_plane_deg","schema_version":1,"value":null},{"name":"entry_orientation","schema_version":1,"value":null},{"name":"entry_target","schema_version":1,"value":null},{"name":"flexion_deg","schema_version":1,"value":null},{"name":"hold_s","schema_version":1,"value":0.1},{"name":"left_elbow_plane_deg","schema_version":1,"value":null},{"name":"left_entry_orientation","schema_version":1,"value":null},{"name":"left_entry_target","schema_version":1,"value":null},{"name":"left_orientation","schema_version":1,"value":null},{"name":"left_target","schema_version":1,"value":null},{"name":"left_torso_orientation","schema_version":1,"value":null},{"name":"left_torso_target","schema_version":1,"value":null},{"name":"orientation","schema_version":1,"value":null},{"name":"orientation_frame","schema_version":1,"value":"world"},{"name":"path","schema_version":1,"value":"line"},{"name":"plane_policy","schema_version":1,"value":"soft"},{"name":"position_frame","schema_version":1,"value":"world"},{"name":"return_policy","schema_version":1,"value":"return_to_entry"},{"name":"right_elbow_plane_deg","schema_version":1,"value":null},{"name":"right_entry_orientation","schema_version":1,"value":null},{"name":"right_entry_target","schema_version":1,"value":null},{"name":"right_orientation","schema_version":1,"value":null},{"name":"right_target","schema_version":1,"value":null},{"name":"right_torso_orientation","schema_version":1,"value":null},{"name":"right_torso_target","schema_version":1,"value":null},{"name":"side","schema_version":1,"value":"left"},{"name":"target","schema_version":1,"value":null},{"name":"torso_orientation","schema_version":1,"value":null},{"name":"torso_target","schema_version":1,"value":null}],"schema_version":1}