{"clause_ids":[],"definition_id":"elbow.flex","definition_version":1,"explicit_parameters":[],"instance_id":"hand.1","parameters":[{"name":"angle","schema_version":1,"value":45},{"name":"duration_s","schema_version":1,"value":1.5},{"name":"hold_s","schema_version":1,"value":0.1},{"name":"left_angle","schema_version":1,"value":null},{"name":"return_policy","schema_version":1,"value":"return_to_entry"},{"name":"right_angle","schema_version":1,"value":null},{"name":"side","schema_version":1,"value":"left"}],"schema_version":1}