{"clause_ids":[],"definition_id":"torso.twist","definition_version":1,"explicit_parameters":[],"instance_id":"body.1","parameters":[{"name":"angle","schema_version":1,"value":10},{"name":"duration_s","schema_version":1,"value":1},{"name":"hold_s","schema_version":1,"value":0.1},{"name":"plane","schema_version":1,"value":"yaw"},{"name":"return_policy","schema_version":1,"value":"return_to_entry"}],"schema_version":1}
