{"clause_ids":[],"definition_id":"hand.orient","definition_version":1,"explicit_parameters":[],"instance_id":"hand.1","parameters":[{"name":"angle","schema_version":1,"value":30},{"name":"duration_s","schema_version":1,"value":1.5},{"name":"entry_orientation","schema_version":1,"value":null},{"name":"hold_s","schema_version":1,"value":0.1},{"name":"left_angle","schema_version":1,"value":null},{"name":"left_entry_orientation","schema_version":1,"value":null},{"name":"left_orientation","schema_version":1,"value":null},{"name":"left_torso_orientation","schema_version":1,"value":null},{"name":"orientation","schema_version":1,"value":null},{"name":"orientation_frame","schema_version":1,"value":"world"},{"name":"return_policy","schema_version":1,"value":"return_to_entry"},{"name":"right_angle","schema_version":1,"value":null},{"name":"right_entry_orientation","schema_version":1,"value":null},{"name":"right_orientation","schema_version":1,"value":null},{"name":"right_torso_orientation","schema_version":1,"value":null},{"name":"side","schema_version":1,"value":"left"},{"name":"torso_orientation","schema_version":1,"value":null}],"schema_version":1}