{"clause_ids":[],"definition_id":"head.look","definition_version":1,"explicit_parameters":[],"instance_id":"move.1","parameters":[{"name":"duration_s","schema_version":1,"value":1},{"name":"frame","schema_version":1,"value":"torso"},{"name":"hold_s","schema_version":1,"value":0.2},{"name":"pitch","schema_version":1,"value":0},{"name":"return_policy","schema_version":1,"value":"preserve_end"},{"name":"target","schema_version":1,"value":null},{"name":"yaw","schema_version":1,"value":25}],"schema_version":1}
