{"clause_ids":[],"definition_id":"arm.reach","definition_version":1,"explicit_parameters":[],"instance_id":"arm.1","parameters":[{"name":"distance_m","schema_version":1,"value":0.02},{"name":"duration_s","schema_version":1,"value":1.5},{"name":"frame","schema_version":1,"value":"entry_body"},{"name":"hold_s","schema_version":1,"value":0.1},{"name":"left_target","schema_version":1,"value":null},{"name":"plane","schema_version":1,"value":"forward"},{"name":"return_policy","schema_version":1,"value":"return_to_entry"},{"name":"right_target","schema_version":1,"value":null},{"name":"side","schema_version":1,"value":"left"},{"name":"target","schema_version":1,"value":null}],"schema_version":1}